﻿en-sv,"the period since the amendment came into force has been quite short .","perioden sedan ändringen trädde i kraft har varit ganska kort.","the period since the entry into force of the amendment have been rather short.",0.72108843537415,0.68091603053435,"Perioden sedan ändringen trädde i kraft har varit ganska kort.","The period since the change came into force has been quite short.",0.8955223880597,0.84406432186559,"den period då ändringen trädde i kraft har varit ganska kort .","the period in which the amendment entered into force have been quite short .",0.86896551724138,0.71564885496183
﻿en-sv,"the hearing is scheduled to resume this weekend .","förhandlingen är planerad att återuppta denna helg.","the hearing is scheduled to resume this weekend.",0.98969072164948,0.89185393258427,"Hörseln är planerad att fortsätta i helgen.","The hearing is scheduled to continue this weekend.",0.86868686868687,0.75556065122678,"förhandlingen är planerad att återuppta denna helg .","the hearing is scheduled to resume this weekend .",1,0.99451303155007
﻿en-sv,"this type of residential community would not be for me .","denna typ av bostadsområde skulle inte vara för mig.","This type of residential area would not be for me.",0.84905660377358,0.81039755351682,"Denna typ av bostadsgemenskap skulle inte vara för mig.","This kind of housing community would not be for me.",0.78504672897196,0.68807339449541,"denna typ av bostadsområde inte skulle vara för mig .","this type of residential area would not be for me .",0.8785046728972,0.89681818181818
﻿en-sv,"234 articles are in some aspects cause for concern .","234 artiklar är i vissa aspekter anledning till oro.","234 articles are in certain aspects of concern.",0.80808080808081,0.52154195011338,"234 artiklar är i vissa avseenden anledning till oro.","234 articles are in some respects cause concern.",0.92,0.64764681382757,"234 artiklarna är i vissa aspekter anledning till oro .","234 articles is in certain aspects a cause for concern .",0.85185185185185,0.69538985148515
﻿en-sv,"the production sent us several videos and that was the band that we liked most .","produktionen skickade oss flera videor och det var bandet som vi gillade mest.","the production sent us several videos and it was the band that we liked the most.",0.94409937888199,0.9075,"Produktionen skickade oss flera videor och det var det band som vi gillade mest.","The production sent us several videos and that was the band we liked most.",0.94805194805195,0.88171661069491,"produktionen skickade oss flera filmer och det var band som vi gillade mest .","the production sent us several movies and it was the band that we liked the most .",0.92592592592593,0.88433402346446
﻿en-sv,"the First World War ended abruptly .","Första världskriget slutade abrupt.","The first world war ended abruptly.",0.87323943661972,0.85346215780998,"Första världskriget slutade plötsligt.","First World War ended suddenly.",0.77611940298507,0.55147058823529,"Första Världskriget slutade abrupt .","The first world War abruptly ended .",0.75,0.9067055393586
﻿en-sv,"I am in charge of repairs and shopping .","Jag är ansvarig för reparationer och shopping.","I am responsible for the repairs and shopping.",0.72093023255814,0.50112359550562,"Jag har ansvaret för reparationer och shopping.","I am in charge of repairs and shopping.",0.9873417721519,0.89185393258427,"Jag är ansvarig för reparationer och shopping .","I am responsible for the repairs and shopping .",0.73563218390805,0.625
﻿en-sv,"Georg Schmitt explained the newly drawn-up guidelines for pastoral care units .","Georg Schmitt förklarade nyligen dragit upp riktlinjerna för själavård enheter.","Georg Schmitt explained recently drawn up guidelines for pastoral care units.",0.91025641025641,0.65454306722689,"Georg Schmitt förklarade de nyligen utarbetade riktlinjerna för pastoral care units.","Georg Schmitt explained the newly developed guidelines for pastoral care units.",0.91139240506329,0.82899159663866,"Georg Schmitt förklarade nyligen dragit upp riktlinjer för själavården enheter .","Georg Schmitt explained recently drawn up guidelines for pastoral care units .",0.9171974522293,0.73611111111111
﻿en-sv,"all nodes in the network are both custodians of the book of accounts .","alla noder i nätverket är båda väktare av boka av konton.","all nodes in the network are both guardians of the book of accounts.",0.94202898550725,0.85656474820144,"Alla noder i nätverket är båda förvaltare av boken.","All nodes in the network are both managers of the book.",0.784,0.72007299270073,"alla noder i nätverket är både vårdnadshavare om boken konton .","all nodes in the network are both custodians of the book of accounts .",1,0.99854227405248
﻿en-sv,"I believe that the German foreign policy is motivated by the economic policy .","Jag tror att den tyska utrikespolitiken motiveras av den ekonomiska politiken.","I think the German foreign policy is motivated by economic policy.",0.875,0.70656934306569,"Jag tror att den tyska utrikespolitiken motiveras av den ekonomiska politiken.","I believe that German foreign policy is motivated by economic policy.",0.93877551020408,0.7836158532907,"Jag tror att den tyska utrikespolitiken är motiverade av den ekonomiska politiken .","I believe that the German foreign policy is motivated by economic policy .",0.97368421052632,0.92950491677664
﻿en-sv,"the core experience of boredom , he said , is "" disruption of the attention process , with a low mood and a sense that time is passing slowly . ""","core upplevelsen av tristess, sade han, är ”störningar av uppmärksamhet processen, med en nedstämdhet och en känsla av att tiden går långsamt”.","core experience of boredom, he said, is ""disturbances of attention process, with a sadness and a sense of time passing slowly"".",0.81617647058824,0.4775161588181,"Kärnan erfarenhet av tristess, sade han, är ""störning av uppmärksamhetsprocessen, med ett lågt humör och en känsla av att tiden går långsamt.""","The core experience of sadness, he said, is ""disturbing the attention process, with a low mood and a feeling that time is slow.""",0.82051282051282,0.54988901322669,"kärnan erfarenhet av tristess , sade han , är "" störningar av uppmärksamhet process , med en nedstämdhet och en känsla av att tiden går långsamt . ""","the core experience of boredom , he said , is "" disruption of the attention process , with a depressed mood and a feeling that time goes slowly . """,0.89041095890411,0.81287928225481
﻿en-sv,"Steven Bathiche from our Redmond laboratory created a touch sensor .","Steven Bathiche från vårt Redmond laboratorium skapade en touch-sensor.","Steven Bathiche from our Redmond lab created a touch sensor.",0.9375,0.81039755351682,"Steven Bathiche från vårt Redmond-laboratorium skapade en touch-sensor.","Steven Bathiche from our Redmond laboratory created a touch sensor.",0.99259259259259,0.91376146788991,"Steven Bathiche från våra Redmond laboratorium skapas en touch-sensor .","Steven Bathiche from our Redmond laboratory created a touch-sensor .",0.98529411764706,0.8211575489863
﻿en-sv,"almost a fourth of American teenagers went through McDonald 's .","nästan en fjärdedel av amerikanska tonåringar gick igenom Mcdonald's.","nearly a quarter of u.s. teens went through Mcdonald's.",0.70588235294118,0.18518518518519,"nästan en fjärdedel av amerikanska tonåringar gick genom McDonald's.","Nearly a quarter of American teens went through McDonald's.",0.82926829268293,0.34444444444444,"nästan en fjärdedel av Amerikanska tonåringar gick igenom McDonald 's .","almost a quarter of American teenagers went through the McDonald's .",0.90909090909091,0.70809659090909
﻿en-sv,"he takes it to the city and sells for 900 euros a piece with two magazines .","Han tar det till staden och säljer för 900 euro en bit med två tidningar.","He takes it to the city and selling for 900 euros a piece with two magazines.",0.95424836601307,0.88402366863905,"Han tar det till staden och säljer för 900 euro en bit med två tidningar.","He takes it to the city and sells for 900 euros a piece of two newspapers.",0.85333333333333,0.82432677212897,"han tar den till staden och säljer för 900 euro en bit med två tidningar .","he takes it to the city and sells for 900 euro a piece with two magazines .",0.99337748344371,0.93807444852941
﻿en-sv,"we received emails for weeks and weeks before the start of the term .","Vi fick mail i veckor och veckor före starten av termen.","We got mail for weeks and weeks before the start of the term.",0.87692307692308,0.78334026993281,"Vi mottog e-postmeddelanden i veckor och veckor före början av terminen.","We received emails for weeks and weeks before the start of the term.",0.97810218978102,0.93354901877315,"vi fick e-post till veckor och veckor före start av begreppet .","we received the e-mail for weeks and weeks prior to the start of the term .",0.88888888888889,0.84402866905575
﻿en-sv,"Mr Tripodi was initially in favour of public tenders .","Herr Tripodi var initialt till förmån för offentliga upphandlingar.","Mr Tripodi was initially in favour of public tenders.",0.99065420560748,0.90410275595461,"Tripodi var ursprungligen för offentliga anbud.","Tripodi was originally for public tenders.",0.79166666666667,0.32877604166667,"Herr Tripodi ursprungligen för offentliga anbud .","Mr Tripodi was originally for a public tender .",0.83168316831683,0.45050505050505
﻿en-sv,"it must be admitted that there is no miraculous or diabolical source of production of electricity .","Det måste medges att det finns ingen mirakulösa eller diabolisk källa av elproduktionen.","It must be admitted that there is no miraculous or fiendish source of electricity production.",0.79166666666667,0.81435252672498,"det måste erkännas att det inte finns någon mirakulös eller djävulsk produktionskälla för el.","It must be acknowledged that there is no miraculous or devilish power source for electricity.",0.76041666666667,0.62401613537977,"det måste medges att det är ingen mirakulös eller djävulskt källa för produktion av el .","it must be admitted that there is no miraculous or diabolical source for the production of electricity .",0.96551724137931,0.92139528508772
﻿en-sv,"administrators at Penn State have been charged with perjury .","Administratörer på Penn State har åtalats för mened.","Administrators at Penn State have been prosecuted for perjury.",0.82926829268293,0.67924139352711,"administratörer hos Penn State har blivit belastad med mejeri.","Penn State administrators have been charged with dairy.",0.70689655172414,0.64764681382757,"administratörer vid Penn State har åtalats för mened .","administrators at Penn State have been prosecuted for perjury .",0.85483870967742,0.77890625
﻿en-sv,"the police blocked off the road .","polisen spärrade av vägen.","Police blocked off the road.",0.88524590163934,0.54705882352941,"polisen blockerade av vägen.","The police blocked off the road.",0.95384615384615,0.85346215780998,"polisen spärrade av vägen .","the police blocked off the road .",1,0.98833819241983
﻿en-sv,"specific criteria are being determined in order to decide who should or should not be treated .","särskilda kriterier skall fastställas för att avgöra vem som bör eller inte bör behandlas.","specific criteria must be established to determine who should or should not be treated.",0.75824175824176,0.60523580937299,"specifika kriterier bestäms för att bestämma vem som ska eller ska inte behandlas.","Specific criteria are determined to determine who should or should not be treated.",0.85875706214689,0.6967453145917,"specifika kriterier som fastställts för att bestämma vem som bör eller inte bör behandlas .","specific criteria established to determine who should or should not be treated .",0.78857142857143,0.6467191078363
﻿en-sv,"the small town is bursting with overpowering architecture from Soviet times .","den lilla staden sprudlar av överväldigande arkitektur från sovjettiden.","the small town bursting with overwhelming architecture of the Soviet era.",0.84,0.59020483193277,"den lilla staden spränger med överväldigande arkitektur från sovjetiska tider.","The small town blows with overwhelming architecture from Soviet times.",0.84353741496599,0.63559322033898,"den lilla staden är full med överväldigande arkitektur från Sovjettiden .","the small town is full with overpowering architecture from Soviet times .",0.93333333333333,0.90736914600551
﻿en-sv,"a stylist must know how to add the curves necessary .","en stylist måste veta hur du lägger till den nödvändiga kurvor.","a stylist will need to know how to add the necessary curves.",0.76106194690265,0.7463963963964,"en stylist måste veta hur man lägger till de kurvor som är nödvändiga.","A stylist must know how to add the curves that are necessary.",0.89473684210526,0.88873873873874,"en stylist måste veta hur man lägger till de kurvor som är nödvändiga .","a stylist must know how to add the curves that are necessary .",0.92173913043478,0.97218122786305
﻿en-sv,"during the period she was being investigated , Ms Pawlby 's grandparents received anonymous calls asking for information about her .","under perioden hon var utreds, fick Ms Pawlbys farföräldrar anonyma samtal ber om information om henne.","during the period she was under investigation, was Ms. Pawlbys parents anonymous call asking for information about her.",0.85258964143426,0.59714718577595,"Under perioden som hon undersöktes fick Pawlbys morföräldrar anonyma samtal och begärde information om henne.","During the period she was investigated, Pawlby's grandparents received anonymous calls and requested information about her.",0.87058823529412,0.60297301197864,"under den tid hon var utreds , Ms Pawlby 's mor-och farföräldrar fått anonyma samtal frågar efter information om henne .","during the time she was being investigated , Ms Pawlby's grandparents received anonymous calls asking for information about her .",0.96551724137931,0.84529505582137
﻿en-sv,"the project has been joined by over 12 thousand school children .","projektet har fått sällskap av över 12 tusen skolbarn.","the project has been joined by over 12 thousand schoolchildren.",0.984375,0.75852688847039,"Projektet har förenats med över 12 tusen skolbarn.","The project has been associated with over 12 thousand schoolchildren.",0.86567164179104,0.56987201660325,"projektet har fått sällskap av över 12 tusen barn i skolan .","the project has been joined by over 12 thousand children in the school .",0.84671532846715,0.9779122814942
﻿en-sv,"the Alb men stood on the other side of the net .","Alb männen stod på andra sidan av nätet.","ALB men stood on the other side of the net.",0.9010989010989,0.75593220338983,"Alb män stod på andra sidan nätet.","Alb men stood on the other side of the net.",0.94505494505495,0.75593220338983,"den Alb män stod på andra sidan nätet .","the Alb men stood on the other side of the net .",1,0.99768518518519
﻿en-sv,"ice cream lights up when it reacts with the heat of the mouth .","glass som tänds när den reagerar med värmen i munnen.","glass that lights up when it reacts with the heat of your mouth.",0.81889763779528,0.70971223021583,"Glass tänds när den reagerar med munens värme.","Glass lights when it reacts with the mouth's heat.",0.70796460176991,0.47014361300076,"glass tänds när den reagerar med värme i munnen .","ice cream lights up when it reacts with heat in the mouth .",0.9344262295082,0.83208433253397
﻿en-sv,"58 senators voted in favor of a non-binding resolution .","58 senatorer röstade för en icke bindande resolution.","58 senators voted for a non-binding resolution.",0.9126213592233,0.57989690721649,"58 senatörer röstade för en icke-bindande resolution.","58 senators voted for a non-binding resolution.",0.9126213592233,0.57989690721649,"58 senatorer röstade för en icke-bindande resolution .","58 senators voted for a non-binding resolution .",0.92307692307692,0.68617242815494
﻿en-sv,"in 2005 , the fear of invasion was felt both on the Left and on the Right .","2005 var rädslan för invasionen kände både till vänster och till höger.","2005 was the fear of invasion felt both to the left and to the right.",0.86111111111111,0.6771303446662,"År 2005 kändes rädslan för invasion både på vänster och till höger.","In 2005, the fear of invasion felt both left and right.",0.8,0.55391009410978,"i 2005 , den rädslan för invasion var kände mig både på Vänster och Höger .","in 2005 , the fear of invasion was felt both on the Left and the Right .",0.97959183673469,0.93763893990064
﻿en-sv,"only towards the end does the highly charged performance start to wind down .","först mot slutet startar laddad prestanda att varva ner.","only at the end starts charged performance to unwind.",0.70769230769231,0.31584362139918,"bara mot slutet börjar den högt laddade prestandan att gå ner.","Just towards the end, the highly charged performance begins to go down.",0.7972972972973,0.59626051171945,"först mot slutet gör den mycket laddade föreställningen börjar att varva ner .","only towards the end do the very loaded notion starts to unwind .",0.73239436619718,0.45661430039642
﻿en-sv,"we must cut the clothes out of magazines or find them on the Internet .","Vi måste skära kläder ur tidningar eller hitta dem på Internet.","We must cut clothing out of newspapers or find them on the Internet.",0.82014388489209,0.68293500111682,"Vi måste skära kläderna ut ur tidskrifter eller hitta dem på Internet.","We have to cut the clothes out of magazines or find them on the Internet.",0.91666666666667,0.86134122287968,"vi måste skära kläder ur tidningar eller hitta dem på Internet .","we must cut clothes from magazines or find them on the Internet .",0.91176470588235,0.76013513513514
﻿en-sv,"can an America weakened by crisis lead a complex world ?","kan leda ett Amerika som försvagats av krisen en komplex värld?","can lead an America that weakened by the crisis, a complex world?",0.82644628099174,0.7463963963964,"kan en amerikansk försvagad kris leda en komplex värld?","can an American weakened crisis lead a complex world?",0.95412844036697,0.69444444444444,"kan ett Amerika som har försvagats av krisen att leda en komplex värld ?","can an America that has been weakened by the crisis, to lead in a complex world ?",0.81751824817518,0.87133086349387
﻿en-sv,"high speed rail has the potential to bring huge economic benefits to Scotland .","höghastighetståg har potential att ge stora ekonomiska fördelar till Skottland.","high-speed rail has the potential to provide substantial economic benefits to Scotland.",0.83132530120482,0.64009661835749,"höghastighetståg har potential att ge stora ekonomiska fördelar till Skottland.","high-speed trains have the potential to provide major financial benefits to Scotland.",0.74390243902439,0.40760869565217,"high speed rail har potential att ge stora ekonomiska fördelar till Skottland .","high speed rail has the potential to provide major economic benefits to Scotland .",0.8944099378882,0.85044642857143
﻿en-sv,"the instable markets put the yield of the Italian BTP bonds to","de instabila marknaderna sätta avkastningen av de italienska BTP obligationerna till","the volatile markets put the return of the Italian BTP bonds to",0.848,0.82208333333333,"de instabila marknaderna gav avkastningen av de italienska BTP-obligationerna till","The unstable markets yielded the return of the Italian BTP bonds",0.79365079365079,0.59020483193277,"den instabila marknader sätta avkastningen av den italienska BTP obligationer till","the volatile markets set the yield of the Italian BTP bonds to",0.88709677419355,0.82208333333333
﻿en-sv,"the small Italian company now has almost 100 and two offices .","små italienska företaget har nu nästan 100 och två kontor.","small Italian company now has almost 100 and two offices.",0.95798319327731,0.84406779661017,"Det lilla italienska företaget har nu nästan 100 och två kontor.","The small Italian company now has almost 100 and two offices.",0.97560975609756,0.92159177720675,"de små italienska företaget nu har en nästan 100-och två kontor .","the small Italian company now has almost 100 and two offices .",1,0.99768518518519
﻿en-sv,"the civil war pits the primarily Sunni Muslim rebels against Assad 's government and its security forces .","inbördeskriget gropar främst sunnitiska muslimska rebellerna mot Assads regering och dess säkerhetsstyrkor.","the civil war pits mostly Sunni Muslim rebels against Assad's Government and its security forces.",0.91625615763547,0.72376558686859,"inbördeskriget sätter i första hand sunniska muslimska rebeller mot Assads regering och dess säkerhetsstyrkor.","Civil War primarily puts Sunni Muslim rebels against Assad's government and its security forces.",0.88118811881188,0.65715751262626,"inbördeskriget gropar i huvudsak Sunni-Muslimska rebeller mot Assad 's regering och dess säkerhetsstyrkor .","the civil war pits mainly Sunni Muslim rebels against Assad's government and its security forces .",0.95098039215686,0.77734464572346
﻿en-sv,"my sister and I were allowed to eat candy .","min syster och jag fick äta godis.","My sister and I got to eat the candy.",0.75,0.64110492681921,"min syster och jag fick äta godis.","My sister and I had to eat candy.",0.81578947368421,0.68617242815494,"min syster och jag fick äta godis .","my sister and I got to eat candy .",0.83116883116883,0.78677398989899
﻿en-sv,"Jackson has offered a host of amendments .","Jackson har erbjudit en mängd ändringsförslag.","Jackson has offered a number of amendments.",0.87058823529412,0.7120253164557,"Jackson har erbjudit en mängd ändringar.","Jackson has offered a variety of changes.",0.74698795180723,0.56455696202532,"Jackson har erbjudit en mängd ändringar .","Jackson has offered a variety of changes .",0.76190476190476,0.703125
﻿en-sv,"there are salesmen on labour markets .","Det finns försäljare på arbetsmarknaderna.","There are sellers of labour markets.",0.83783783783784,0.45742753623188,"Det finns försäljare på arbetsmarknaden.","There are salespeople in the labor market.",0.775,0.14285714285714,"det är säljare på arbetsmarknaden .","there are sellers on the labour market .",0.84615384615385,0.52394366197183
﻿en-sv,""" let me say directly to these Americans : you deserve better , "" Sebelius said .","”Låt mig säga direkt till dessa amerikaner: du förtjänar bättre”, Sebelius sade.","""Let me say directly to these Americans: you deserve better,"" Sebelius said.",0.95541401273885,0.65509259259259,"""låt mig säga direkt till dessa amerikaner: du förtjänar bättre,"" sade Sebelius.","""let me say directly to these Americans: you deserve better,"" said Sebelius.",0.89171974522293,0.61952861952862,"""låt mig säga direkt att dessa Amerikaner : du förtjänar bättre"", Sebelius sagt .","""let me say directly to these Americans : you deserve better,"" Sebelius said .",0.9811320754717,0.76011242820481
﻿en-sv,"people seem to quickly lose courage when following a code of ethics .","folk verkar snabbt tappa modet när du följer etiska regler.","people seem to quickly lose heart when you follow the ethical rules.",0.74452554744526,0.43604651162791,"människor verkar snabbt förlora mod när de följer en etisk kod.","People seem to quickly lose courage when following an ethical code.",0.86764705882353,0.69010416666667,"folk verkar snabbt förlora modet när du följer en etisk kod .","people seem to quickly lose courage when you follow a code of ethics .",0.94964028776978,0.90887404580153
﻿en-sv,"the study notes that the medicalisation of death has produced a culture in which people are afraid to tackle the subject .","studien konstaterar att medikalisering av döden har producerat en kultur där människor är rädda för att ta itu med ämnet.","the study notes that the medicalisation of death has produced a culture where people are afraid to deal with the topic.",0.86307053941909,0.77119969663933,"Studien konstaterar att dödens medicinering har skapat en kultur där människor är rädda för att ta itu med ämnet.","The study finds that the medication of death has created a culture in which people are afraid of dealing with the subject.",0.81967213114754,0.75574079899339,"studien konstaterar att medikalisering av döden har tagit fram en kultur där människor är rädda för att ta itu med ämnet .","the study notes that the medicalization of death has developed a culture where people are afraid to deal with the subject .",0.85714285714286,0.75574079899339
﻿en-sv,"I have always washed my hair with milk .","Jag har alltid tvättat mitt hår med mjölk.","I have always washed my hair with milk.",0.9873417721519,0.89185393258427,"Jag har alltid tvättat mitt hår med mjölk.","I have always washed my hair with milk.",0.9873417721519,0.89185393258427,"Jag har alltid tvättat mitt hår med mjölk .","I have always washed my hair with milk .",1,0.99451303155007
﻿en-sv,"life continues under the best possible conditions .","livet fortsätter under bästa möjliga förhållanden.","life continues under the best possible conditions.",0.99009900990099,0.87574270214415,"livet fortsätter under bästa möjliga förhållanden.","life continues under the best possible conditions.",0.99009900990099,0.87574270214415,"livet fortsätter och under bästa möjliga förhållanden .","life continues and under the best possible conditions .",0.9622641509434,0.96161265432099
