﻿en-sv,"Let us imagine for a minute that manipulation of virtual holographic objects in the air is available .","Låt oss föreställa oss en minut att manipulering av virtuella holografisk objekt i luften är tillgänglig.","Let's imagine for a minute that the manipulation of the virtual holographic object in the air are available.",0.91428571428571,0.77012345679012,"Låt oss föreställa oss en minut att manipulering av virtuella holografiska objekt i luften är tillgänglig.","Let's imagine one minute that manipulation of virtual holographic objects in the air is available.",0.95,0.72995018888109,"Låt oss föreställa oss en minut att manipulation av virtuella holografisk objekt i luften finns tillgängligt .","Let us imagine for a minute that the manipulation of virtual holographic objects in the air is available .",0.98076923076923,0.99088788453127
﻿en-sv,"Vicenová further focused on the agenda crucial for the EU .","Vicenová ytterligare fokuserat på dagordningen avgörande för EU.","Vicenová further focused on the agenda vital for the EU.",0.94017094017094,0.81039755351682,"Vicenová fokuserade vidare på agendan som är avgörande för EU.","Vicenová focused on the agenda that is crucial for the EU.",0.85714285714286,0.78226711560045,"Vicenová att fokusera ytterligare på dagordningen avgörande för EU .","Vicenová to focus further on the agenda, crucial for the EU .",0.85245901639344,0.87207207207207
﻿en-sv,"I look back , for instance , to the lecture of A Sternfeld in Warsaw 's astronomy observatory .","Jag ser tillbaka, exempelvis att föreläsa av A Sternfeld i Warszawas astronomy observatory.","I look back, for example, that the lecture of A Sternfeld in Warsaw's astronomy observatory.",0.89839572192513,0.58113052568698,"Jag ser tillbaka till exempel till föreläsningen av A Sternfeld i Warszawas astronomi observatorium.","For example, I look back to the lecture of A Sternfeld in Warsaw's Astronomy Observatory.",0.80434782608696,0.64436597315009,"Jag ser tillbaka , till exempel till en föreläsning av En Sternfeld i Warszawa 's astronomiska observatorium .","I look back , for example, to a lecture by A Sternfeld in Warsaw's astronomical observatory .",0.86170212765957,0.53411809140123
﻿en-sv,"because I have neither the time nor the money to do it .","eftersom jag har varken tid eller pengar för att göra det.","because I have neither the time or the money to do it.",0.98181818181818,0.84406432186559,"för att jag inte har tid eller pengar att göra det.","because I do not have the time or money to do it.",0.8,0.6422480620155,"eftersom jag har varken tid eller pengar att göra det .","since I have neither the time nor the money to do it .",0.92727272727273,0.92094017094017
﻿en-sv,"increasing number of employed persons are looking after the long-term care .","öka antalet sysselsatta personer söker efter långsiktig vård.","increase the number of employed people looking for long term care.",0.80281690140845,0.35830999066293,"Ett ökande antal anställda letar efter långtidsvården.","An increasing number of employees are looking for long-term care.",0.86524822695035,0.53787616741612,"att öka antalet sysselsatta letar efter långsiktiga vård .","to increase the number of employed persons looking for long-term care .",0.84353741496599,0.68569958847737
﻿en-sv,"I felt a light tap on my shoulder .","Jag kände ett lätt tryck på min axel.","I felt a slight pressure on my shoulder.",0.85333333333333,0.63202247191011,"Jag kände en lätt kran på min axel.","I felt a light crane on my shoulder.",0.90140845070423,0.75556065122678,"Jag kände ett lätt tryck på min axel .","I felt a light tap on my shoulder .",1,0.99451303155007
﻿en-sv,"but lawmakers are weighing legislation to force a move away from the Sand Hills region .","men lagstiftare väger lagstiftning för att tvinga ett steg bort från regionen Sand Hills.","but lawmakers are weighing legislation to force a move away from the region of Sandy Hills.",0.86033519553073,0.86479591836735,"men lagstiftare väger lagstiftning för att tvinga ett drag bort från Sand Hills-regionen.","But legislators weigh legislation to force a move away from the Sand Hills region.",0.87058823529412,0.75356012658228,"men lagstiftare väger lagstiftning för att tvinga ett steg bort från Sand Kullar regionen .","but lawmakers weighing legislation to force a move away from the Sand Hills region .",0.97674418604651,0.93962264150943
﻿en-sv,"New Express issued a front-page apology .","Nya Express utfärdade en förstasidesnyhet ursäkt.","New Express issued a front-page apology.",0.98765432098765,0.85346215780998,"New Express gav ut ursäkt på förhand.","New Express apologized in advance.",0.53333333333333,0.14705882352941,"Ny Snabb utfärdat en front-sida ursäkt .","New Express issued a front-page apology .",1,0.98833819241983
﻿en-sv,"football needs trustworthiness , says Pelta .","fotboll behöver trovärdighet, säger Pelta.","Football needs credibility, says Pelta.",0.66666666666667,0.29411764705882,"fotboll behöver trovärdighet, säger Pelta.","football needs credibility, says Pelta.",0.69047619047619,0.29411764705882,"fotboll behov trovärdighet , säger Pelta .","football needs credibility , says Pelta .",0.72093023255814,0.73015873015873
﻿en-sv,"Pangerl has already twice been crowned World Champion .","Pangerl har redan två gånger varit krönt världsmästare.","Pangerl has already twice been crowned world champion.",0.95412844036697,0.89185393258427,"Pangerl har redan två gånger blivit crowned världsmästare.","Pangerl has twice been crowned world champion.",0.87128712871287,0.764146567718,"Pangerl har redan två gånger blivit krönt Världsmästare .","Pangerl has already twice been crowned world Champion .",0.98181818181818,0.99451303155007
﻿en-sv,"therefore the experience of the study is also that elderly people would accept inconveniences and limitations .","upplevelsen av studien är därför också att äldre människor skulle acceptera olägenheter och begränsningar.","the experience of the study is therefore also to older people would accept the inconveniences and limitations.",0.85067873303167,0.85411764705882,"Därför är erfarenheten av studien också att äldre människor skulle acceptera olägenheter och begränsningar.","Therefore, the experience of the study is also that older people would accept disadvantages and limitations.",0.87671232876712,0.81874169786258,"därför erfarenhet av studien är också att äldre människor skulle acceptera olägenheter och begränsningar .","therefore, the experience of the study are also that older people would accept inconveniences and limitations .",0.95495495495495,0.87398692810458
﻿en-sv,"the body was found .","kroppen hittades.","the body was found.",0.97435897435897,0.76530612244898,"kroppen hittades.","the body was found.",0.97435897435897,0.76530612244898,"kroppen hittades .","the body was found .",1,0.968
﻿en-sv,"its distributes its notebooks to Fnac libraries and has succeeded in becoming well known .","dess distribuerar dess anteckningsböcker till Fnac bibliotek och har lyckats bli känd.","It distributes its notebooks to Fnac library and has managed to become known.",0.81437125748503,0.51801801801802,"Det distribuerar sina bärbara datorer till Fnac-bibliotek och har lyckats bli välkända.","It distributes its laptops to the Fnac library and has managed to become well-known.",0.73563218390805,0.32187371592932,"dess distribuerar sina bärbara datorer till Fnac bibliotek och har lyckats bli kända .","its distributes their laptops to the Fnac library and has managed to become known .",0.71676300578035,0.51111111111111
﻿en-sv,"the period since the amendment came into force has been quite short .","perioden sedan ändringen trädde i kraft har varit ganska kort.","the period since the entry into force of the amendment have been rather short.",0.72108843537415,0.68091603053435,"Perioden sedan ändringen trädde i kraft har varit ganska kort.","The period since the change came into force has been quite short.",0.8955223880597,0.84406432186559,"den period då ändringen trädde i kraft har varit ganska kort .","the period in which the amendment entered into force have been quite short .",0.86896551724138,0.71564885496183
﻿en-sv,"how fast the change is implemented will vary by the airline .","Hur snabbt förändringen genomförs varierar av flygbolaget.","How quickly the change vary by airline.",0.62,0.3707729468599,"hur snabbt förändringen genomförs varierar av flygbolaget.","how fast the change is made varies by the airline.",0.81081081081081,0.66009004237288,"hur snabbt förändringen genomförs varierar mellan olika flygbolag .","how fast the change is implemented varies between the different airlines .",0.8,0.64908854166667
﻿en-sv,"only the Senate may propose laws .","endast senaten föreslå lagar.","only the Senate propose laws.",0.92063492063492,0.65588235294118,"Endast senaten kan föreslå lagar.","Only the Senate can propose laws.",0.8955223880597,0.6463768115942,"bara Senaten kan föreslå lagar .","only the Senate can propose laws .",0.94117647058824,0.80357142857143
﻿en-sv,"according to Baranets , the buyer is not offered a pig in a poke .","enligt Baranets erbjuds köparen inte en grisen i säcken.","as per Baranets offers the buyer not a pig in a poke.",0.72268907563025,0.52154195011338,"Enligt Baranets erbjuds köparen inte en gris i en poke.","According to Baranets, the buyer is not offered a pig in a poke.",0.96923076923077,0.86558451943067,"enligt Baranets , köparen erbjuds inte grisen i säcken .","according to Baranets , the buyer is not offered a pig in a poke .",1,0.99051851851852
﻿en-sv,"Axel Weber was delighted .","Axel Weber var glad.","Axel Weber was happy.",0.72340425531915,0.52154195011338,"Axel Weber var glad.","Axel Weber was happy.",0.72340425531915,0.52154195011338,"Axel Weber var glad .","Axel Weber was happy .",0.75,0.75
﻿en-sv,"beneath her headscarf she conceals long , dark blond plaits .","under sin sjalett döljer hon långa, mörka blonda flätor.","During her head scarf hiding her long, dark blond braids.",0.67796610169492,0.22935779816514,"Under hennes huvudduk döljer hon långa, mörka blonda flätor.","Under her headcloth she hides long, dark blonde braids.",0.68965517241379,0.18518518518519,"under hennes huvudduk hon döljer lång , mörk blonda flätor .","under her headscarf she hides the long , dark blond braids .",0.7603305785124,0.63274211711712
﻿en-sv,"the Police Chief argues that there is no more division of power .","Polismästaren hävdar att det finns ingen mer uppdelning av driver.","Police Chief claims that there are no more Division of power.",0.84126984126984,0.67226080246914,"Polischefen hävdar att det inte finns någon större maktfördelning.","The police chief claims that there is no major power distribution.",0.68702290076336,0.5859375,"polischefen hävdar att det inte är mer fördelning av makt .","the chief of police, claiming that there is more distribution of power .",0.71532846715328,0.68340750158932
﻿en-sv,"in 2008 , the CNAM found that 13 % of the 285 000 controls were unjustified .","2008 fann CNAM att 13% av 285 000 kontrollerna var omotiverad.","2008 CNAM found that 13% of 285 000 checks was unjustified.",0.77941176470588,0.41967780788919,"Under 2008 konstaterade CNAM att 13% av de 285 000 kontrollerna var obefogade.","In 2008, CNAM found that 13% of the 285,000 controls were unjustified.",0.92517006802721,0.53844227397946,"under 2008 CNAM fann att 13 % av de 285 000 kontroller var omotiverade .","in 2008, the CNAM found that 13 % of the 285 000 checks was unjustified .",0.89333333333333,0.77662721893491
﻿en-sv,"behind this name hides a fully registered brand .","bakom namnet döljer ett registrerat varumärke.","behind the name hides a registered trademark.",0.80851063829787,0.42272727272727,"bakom detta namn döljer ett helt registrerat varumärke.","Behind this name conceals a completely registered trademark.",0.73394495412844,0.41797752808989,"bakom detta namn döljer sig en helt registrerat varumärke .","behind this name hides a fully registered trademark .",0.92156862745098,0.88194444444444
﻿en-sv,"economic consolidation ( in Latin America ) should not have a triumphalist attitude .","ekonomisk konsolidering (i Latinamerika) bör inte ha en triumferande attityd.","financial consolidation (in Latin America) should not have a triumphant attitude.",0.87951807228916,0.50238803280166,"ekonomisk konsolidering (i Latinamerika) borde inte ha en triumferal attityd.","Economic consolidation (in Latin America) should not have a triumphal attitude.",0.95121951219512,0.60474452554745,"ekonomisk konsolidering ( i latinamerika ) inte bör ha en triumphalist attityd .","economic consolidation ( in Latin america ) should not have a triumphalist attitude .",0.98823529411765,0.96064139941691
﻿en-sv,"on the asphalt covering is placed a final layer which is made of a fine stone material .","på asfalten placeras som täcker ett sista lager som är gjord av ett fint stenmaterial.","on the asphalt placed as a last layer is made of a fine stone materials.",0.825,0.61067953546767,"på asfaltbeläggningen placeras ett slutskikt som är tillverkat av ett fint stenmaterial.","On the asphalt coating an end layer is made of a fine stone material.",0.80254777070064,0.54446844477836,"på asfalten som täcker placeras en sista lagret som är tillverkat av en fin sten material .","on the asphalt, which covers placed a last layer that is made of a fine stone materials .",0.84745762711864,0.72916666666667
﻿en-sv,"in London and Madrid it is completely natural for people with serious handicaps to be independently out in public","i London och Madrid är det helt naturligt för människor med allvarliga handikapp att vara självständigt ute offentligt","in London and Madrid, it is quite natural for people with severe disabilities to be independent out publicly",0.82352941176471,0.66826336057105,"i London och Madrid är det helt naturligt för personer med allvarliga handikapp att vara självständigt ute i allmänhet","In London and Madrid, it is quite natural for people with severe disabilities to be independent in general",0.76712328767123,0.66826336057105,"i London och Madrid, det är helt naturligt för människor med allvarliga svårigheter att självständigt ute i det offentliga","in London and Madrid, it is quite natural for people with serious difficulties to independently out in public",0.87387387387387,0.83994708994709
﻿en-sv,"Ruby was taken to the vets for a check-up .","Ruby togs till veterinärer för en check-up.","Ruby was taken to the vets for a check-up.",0.98823529411765,0.90410275595461,"Ruby togs till veterinärerna för en check-up.","Ruby was taken to the veterinarians for a check-up.",0.8936170212766,0.78677398989899,"Ruby togs till veterinärer för en check-up .","Ruby was taken to the vets for a check-up .",1,0.996
﻿en-sv,"if they are to finally get back on the winning track .","om de ska äntligen komma tillbaka på det vinnande spåret.","If they are to finally get back on the winning track.",0.97196261682243,0.92159177720675,"om de äntligen kommer tillbaka på det vinnande spåret.","if they finally come back on the winning track.",0.87128712871287,0.64102564102564,"om de är för att slutligen komma tillbaka på det vinnande spåret .","if they are to finally get back on the winning track .",1,0.99768518518519
﻿en-sv,"the announcement of the probable discovery of the Higgs boson created quite a stir last summer .","offentliggörandet av den troliga upptäckten av den Higgsbosonen skapade stor uppståndelse förra sommaren.","publication of the probable discovery of the Higgs boson created quite a stir last summer.",0.87096774193548,0.80053449951409,"Tillkännagivandet om den sannolika upptäckten av Higgs boson skapade ganska rörelse förra sommaren.","The announcement about the likely discovery of Higgs boson created quite a stir last summer.",0.88297872340426,0.73577063961679,"tillkännagivandet av den sannolika upptäckten av Higgsbosonen skapat stor uppståndelse förra sommaren .","the announcement of the likely discovery of the Higgs boson, created quite a stir last summer .",0.94240837696335,0.93807444852941
﻿en-sv,"the United Nations is to start work immediately on a new set of goals to replace the millennium development goals .","FN är att omedelbart påbörja arbetet på en ny uppsättning mål att ersätta millenniemålen för utveckling.","The UNITED NATIONS is to immediately begin work on a new set of targets to replace the Millennium development goals.",0.75324675324675,0.83591765609309,"Förenta nationerna ska omedelbart börja arbeta med en ny uppsättning mål för att ersätta millennieutvecklingsmålen.","The United Nations should immediately start working on a new set of targets to replace the Millennium Development Goals.",0.79148936170213,0.72115384615385,"Fn är att börja arbeta direkt på en ny uppsättning av mål för att ersätta millenniemålen .","The united nations is to start working directly on a new set of goals to replace the millennium development goals .",0.92173913043478,0.90298113705316
﻿en-sv,"we handle this in the most civilised manner possible .","Vi hanterar detta i de mest civiliserade sättet som möjligt.","We deal with this in the most civilized way as possible.",0.74545454545455,0.50605060506051,"Vi hanterar detta på det mest civiliserade sättet möjligt.","We handle this in the most civilized way possible.",0.88461538461538,0.67924139352711,"vi hanterar detta i de flesta civiliserade sätt som möjligt .","we handle this in the most civilized manner possible .",0.98148148148148,0.88333333333333
﻿en-sv,"these solutions are false and always lead to a worse situation .","dessa lösningar är falska och alltid leda till en sämre situation.","These solutions are false and always lead to a worse situation.",0.97637795275591,0.92159177720675,"Dessa lösningar är falska och leder alltid till en sämre situation.","These solutions are fake and always lead to a worse situation.",0.95238095238095,0.82899159663866,"dessa lösningar är falska och alltid leda till en sämre situation .","these solutions are false and always lead to a worse situation .",1,0.99768518518519
﻿en-sv,"it is the whole of Europe , which defers to the dictates of rating agencies .","Det är hela Europa, som skjuter till diktat av kreditvärderingsinstituten.","It is the whole of Europe, that shoots to the dictates of the credit rating agencies.",0.80246913580247,0.78938609467456,"Det är hela Europa, som försvinner i de bedömningsbyråernas dikter.","It is the whole of Europe, which disappears in the dictatorships of the assessment agencies.",0.76923076923077,0.60268205208171,"det är hela Europa som skjuter på diktat av kreditvärderingsinstitut .","it is the whole of Europe that defers to the dictates of the rating agencies .",0.91612903225806,0.92013888888889
﻿en-sv,"the Inseen nevertheless revised downwards with a fall of 0,1 % of the gross internal product .","den Inseen ändå reviderats ned med en nedgång på 0,1 procent av den brutto inre produkten.","the Insee still revised down with a fall of 0.1 per cent of the gross internal product.",0.82872928176796,0.66176470588235,"Inseen ändrade dock nedåt med ett fall på 0,1% av den brutto interna produkten.","Inseen, however, changed downwards with a fall of 0.1% of the gross internal product.",0.8268156424581,0.64724717232202,"den Inseen dock reviderats ned med en nedgång på 0,1 procent av den totala interna produkt .","the Inseen, however, been revised down, with a decline of 0.1 per cent of the total internal product .",0.75510204081633,0.59431524547804
﻿en-sv,"the important thing is to have a discussion with your doctor .","viktigt är att ha en diskussion med din läkare.","It is important to have a discussion with your doctor.",0.86206896551724,0.72923205691567,"Det viktiga är att ha en diskussion med din läkare.","The important thing is to have a discussion with your doctor.",0.97560975609756,0.92159177720675,"det viktiga är att man har en diskussion med din läkare .","it is important to have a discussion with your doctor .",0.87179487179487,0.81344537815126
﻿en-sv,"the Tokyo exchange closed with a fall of 0,7 % .","Tokyo börsen stängd med en minskning på 0,7%.","The Tokyo Stock Exchange closed with a fall of 0.7%.",0.86,0.78944387812889,"Tokyo-utbytet stängdes med ett fall på 0,7%.","Tokyo exchange was closed with a fall of 0.7%.",0.87234042553191,0.69444444444444,"Tokyo-börsen stängde med en nedgång på 0,7 procent .","The Tokyo stock exchange closed with a decline of 0.7%.",0.79611650485437,0.64435206422018
﻿en-sv,"the Turkish Community of Germany reacted calmly , remembering the victims during a silent vigil .","Tysklands turkiska gemenskapen reagerat lugnt, att minnas offren under en tyst vaka.","Germany's Turkish community reacted calmly, to remember the victims in a silent vigil.",0.80874316939891,0.43838955728552,"Tysklands turkiska gemenskap reagerade lugnt och kom ihåg offren under en tyst vaksamhet.","The Turkish community of Germany reacted calmly and remembered the victims in silent vigilance.",0.875,0.59335443037975,"den turkiska Samhället i Tyskland reagerade lugnt , minnas offren under en tyst vaka .","the Turkish Community in Germany reacted calmly , remembering the victims during a silent vigil .",0.97938144329897,0.92013888888889
﻿en-sv,"the starkly conflicting impressions illustrate the uneasy relationship between the military and an often distant public .","brutalt motstridiga intrycken illustrera orolig förhållandet mellan militären och en ofta avlägsna allmänheten.","starkly contradictory impressions illustrate the uneasy relationship between the military and an often distant public.",0.92887029288703,0.78125,"De starkt motstridiga intrycken illustrerar det obekväma förhållandet mellan militären och en ofta avlägsen allmänhet.","The highly contradictory impressions illustrate the uncomfortable relationship between the military and an often distant public.",0.85140562248996,0.7580266797381,"den starkt motstridiga intryck illustrera spänt förhållande mellan det militära och det ofta en avlägsen allmänheten .","the starkly conflicting impressions illustrate the uneasy relationship between the military and often a distant public .",0.97925311203319,0.93382352941176
﻿en-sv,"the priority must be jobs and growth in Britain .","prioriteringen måste vara sysselsättning och tillväxt i Storbritannien.","the priority must be growth and employment in the United Kingdom.",0.63157894736842,0.69538985148515,"Prioritering måste vara jobb och tillväxt i Storbritannien.","Priority must be jobs and growth in the UK.",0.82608695652174,0.78677398989899,"måste fokus ligga på jobb och tillväxt i Storbritannien .","the focus must be on jobs and growth in the Uk .",0.74226804123711,0.84362139917695
﻿en-sv,"Bulgarian consumers will receive gas from South Stream .","Bulgariska konsumenterna kommer att få gas från South Stream.","Bulgarian consumers will receive gas from South Stream.",0.99099099099099,0.89185393258427,"Bulgariska konsumenter kommer att få gas från South Stream.","Bulgarian consumers will receive gas from South Stream.",0.99099099099099,0.89185393258427,"Bulgariska konsumenterna kommer att få gas från South Stream .","Bulgarian consumers will receive gas from South Stream .",1,0.99451303155007
﻿en-sv,"the blonde beauty has had short hair .","den blonda skönheten har haft kort hår.","the blonde beauty has had short hair.",0.98666666666667,0.87574270214415,"Den blonda skönheten har kort hår.","The blond beauty has short hair.",0.88571428571429,0.47692307692308,"den blonda skönheten har haft kort hår .","the blonde beauty has had short hair .",1,0.9921875
﻿en-sv,"Caesarea was the main city of Judea .","Caesarea var den viktigaste staden i Judeen.","Caesarea was the most important town in Judea.",0.67469879518072,0.39453125,"Caesarea var Judeas huvudstad.","Caesarea was the capital of Judea.",0.84507042253521,0.57179487179487,"Caesarea var den viktigaste staden i Judeen .","Caesarea was the main city in Judea .",0.94594594594595,0.8405612244898
﻿en-sv,"officials increased disorder training to focus on Lower Manhattan .","tjänstemän ökade störning utbildning att fokusera på nedre Manhattan.","officials increased interference education to focus on lower Manhattan.",0.79710144927536,0.67924139352711,"tjänstemän ökade oordningsträning för att fokusera på Lower Manhattan.","Officials increased disability training to focus on Lower Manhattan.",0.88888888888889,0.78677398989899,"tjänstemän ökade sjukdom träningen att fokusera på Nedre Manhattan .","officials increased disease training to focus on Lower Manhattan .",0.94736842105263,0.88333333333333
﻿en-sv,"New York City agreed to end the practice of storing the names and addresses of people .","New York City enades till slut öva av lagring av namn och adresser till personer.","New York City agreed to end the practice of storing the names and addresses of persons.",0.95402298850575,0.88652202498356,"New York City gick med på att avsluta övningen att lagra namn och adresser till människor.","New York City agreed to end the practice of storing names and addresses to people.",0.9585798816568,0.88439153439153,"New York kommit överens om att avsluta praktiken för att lagra namn och adresser på människor .","New York city agreed to end the practice of storing the names and addresses of people .",0.98850574712644,0.99918583350295
